Content,English,,Español,,
S2 - Portal Dashboard - Card Table - Status Message Deactivated,"This card was reported as lost, stolen, damaged, or otherwise inactive. Email the Summer EBT Help Desk at cdhs_sebt_supportcenter@state.co.us to learn more or report a change.","This card was reported as lost, stolen, damaged, or otherwise inactive. Email the Summer EBT Help Desk at cdhs_sebt_supportcenter@state.co.us to learn more or report a change.","Esta tarjeta fue reportada como perdida, robada, dañada o inactiva. Escribe al centro de ayuda Summer EBT a cdhs_sebt_supportcenter@state.co.us para saber más o reportar un cambio.","Esta tarjeta fue reportada como perdida, robada, dañada o inactiva. Escribe al centro de ayuda Summer EBT a cdhs_sebt_supportcenter@state.co.us para saber más o reportar un cambio.",
S2 - Portal Dashboard - Card Table - Status Message Inactive,"This card was reported as lost, stolen, damaged, or otherwise inactive. Email the Summer EBT Help Desk at cdhs_sebt_supportcenter@state.co.us to learn more or report a change.","This card was reported as lost, stolen, damaged, or otherwise inactive. Email the Summer EBT Help Desk at cdhs_sebt_supportcenter@state.co.us to learn more or report a change.","Esta tarjeta fue reportada como perdida, robada, dañada o inactiva. Escribe al centro de ayuda Summer EBT a cdhs_sebt_supportcenter@state.co.us para saber más o reportar un cambio.","Esta tarjeta fue reportada como perdida, robada, dañada o inactiva. Escribe al centro de ayuda Summer EBT a cdhs_sebt_supportcenter@state.co.us para saber más o reportar un cambio.",
S2 - Portal Dashboard - Card Table - Status Message Frozen,"You won’t be able to use your benefits while this card is frozen. Unfreeze the card to keep using your benefits. This can be done with the ebtEDGE, MyCoBenefits, or Propel apps.","You won’t be able to use your benefits while this card is frozen. Unfreeze the card to keep using your benefits. This can be done with the ebtEDGE, MyCoBenefits, or Propel apps.","No podrás usar tus beneficios mientras esta tarjeta esté congelada. Descongela la tarjeta para seguir usando tus beneficios. Puedes hacerlo con las aplicaciones ebtEDGE, MyCoBenefits o Propel.","No podrás usar tus beneficios mientras esta tarjeta esté congelada. Descongela la tarjeta para seguir usando tus beneficios. Puedes hacerlo con las aplicaciones ebtEDGE, MyCoBenefits o Propel.",
S2 - Portal Dashboard - Card Table - Status Message Undeliverable,The card could not be delivered to the address on file. ,The card could not be delivered to the address on file. ,No se pudo entregar la tarjeta a la dirección que tenemos registrada.,No se pudo entregar la tarjeta a la dirección que tenemos registrada.,
S2 - Portal Dashboard - Card Table - Action Update Mailing Address,Update this card's mailing address,Update this card's mailing address,Actualizar la dirección de correspondencia de esta tarjeta,Actualizar la dirección de correspondencia de esta tarjeta,
S2 - Portal Dashboard - Card Table - Action Request Replacement,Request a replacement card,Request a replacement card,Solicitar una tarjeta de reemplazo,Solicitar una tarjeta de reemplazo,
S2 - Portal Dashboard - Card Table - Action Update Request,Update your address and order a replacement card,Update your address and order a replacement card,Actualiza tu dirección y pide una tarjeta de reemplazo,Actualiza tu dirección y pide una tarjeta de reemplazo,
S2 - Portal Dashboard - Alert EBT Edge - Title,Check balance or change PIN number,Check balance or change PIN number,Revisar balance o cambiar número de PIN,Revisar balance o cambiar número de PIN,
S2 - Portal Dashboard - Alert EBT Edge - Body,If you need to,"When you add your cards to an ebtEDGE account, you can","Cuando agregas tus tarjetas a una cuenta de ebtEDGE, puedes","Cuando agregas tus tarjetas a una cuenta de ebtEDGE, puedes",
S2 - Portal Dashboard - Alert EBT Edge - Features,"Check a card balance and transactions, 
Freeze or unfreeze to protect benefits from theft, 
Or change a card PIN","Check the card balance, 
Freeze or unfreeze to protect benefits from theft, 
Or change the card PIN","Revisar el balance de la tarjeta, 
Congelarlas o descongelarlas para proteger tus beneficios del robo, o
Cambiar la clave de la tarjeta","Revisar el balance de las tarjetas, 
Congelarlas o descongelarlas para proteger tus beneficios del robo, o
Cambiar la clave de la tarjeta",
S2 - Portal Dashboard - Alert EBT Edge - Body 2,You can call EBT Customer Service at (888) 328-2656 or use ebtEDGE online and create an account.,,Puedes llamar al Servicio al Cliente de EBT al (888) 328-2656 o usar ebtEDGE en línea y crear una cuenta.,,
S2 - Portal Dashboard - Alert EBT Edge - Action,Go to ebtEDGE,Go to ebtEDGE,Ir a ebtEDGE,Ir a ebtEDGE,
S2 - Portal Dashboard - Alert EBT Edge - Action 2,Tap to call EBT Customer Service,Tap to call EBT Customer Service,Toca la pantalla para llamar al Servicio al Cliente de EBT,Toca la pantalla para llamar al Servicio al Cliente de EBT,
S2 - Portal Dashboard - Section - Enrolled Children Heading,Enrolled Children,Enrolled Children,Niños inscritos,Niños inscritos,
S2 - Portal Dashboard - Section - Enrolled Children Body 1,"The following children are enrolled in Summer EBT. If you would like to submit an application for a child who isn't enrolled, you may","The following children are enrolled in Summer EBT. If you would like to submit an application for a child who isn't enrolled, you may","Los siguientes niños han sido inscritos automáticamente en Summer EBT. Si quieres, puedes aplicar para un niño que no está inscrito.","Los siguientes niños están inscritos en Summer EBT. Si quieres, puedes aplicar para un niño que no está inscrito.",
S2 - Portal Dashboard - Section - Enrolled Children Body 2,"If you would like to submit an application for a child who isn't enrolled, you may",You may submit an application for a child who isn't enrolled,"Si quieres, puedes enviar una solicitud de un niño que no está inscrito",Puedes aplicar para un niño que no está inscrito,
S2 - Portal Dashboard - Section - Enrolled Children Action,submit a Summer EBT application.,submit a Summer EBT application.,Aplicar para Summer EBT.,Aplicar para Summer EBT.,
S2 - Portal Dashboard - Section - Applications Heading,Summer EBT Applications,Summer EBT Applications,Aplicaciones de Summer EBT,Aplicaciones de Summer EBT,
S2 - Portal Dashboard - Section - Applications Body,Here are your Summer EBT applications for children who haven't been automatically enrolled.,Here are your Summer EBT applications for children who haven't been automatically enrolled.,Aquí están tus aplicaciones de Summer EBT para los niños que no se han inscrito automáticamente.,Aquí están tus aplicaciones de Summer EBT para los niños que no se han inscrito automáticamente.,
S2 - Portal Dashboard - Applications Table - Heading Number,SEBT Application Tracking ID,Case number,Número de seguimiento de la solicitud de SEBT,Número de la aplicación,
S2 - Portal Dashboard - Applications Table - Heading Date Submitted,,Date submitted,,Fecha de envío,
S2 - Portal Dashboard - Applications Table - Heading Children Included,Children included in application,Children included in application,Niños incluídos en la aplicación,Niños incluídos en la aplicación,
S2 - Portal Dashboard - Applications Table - Heading Status,Status,Status,Estado,Estado,
S2 - Portal Dashboard - Applications Table - Status Approved,Approved,Approved,Aprobada,Aprobada,
S2 - Portal Dashboard - Alert Applications Title,"Currently, you have no children enrolled in Summer EBT or Summer EBT applications","Currently, you have no children enrolled in Summer EBT or Summer EBT applications","Actualmente, no tiene menores inscritos en Summer EBT ni aplicaciones de Summer EBT","Actualmente, no tienes menores inscritos en Summer EBT ni solicitudes de Summer EBT",
S2 - Portal Dashboard - Alert Applications Body,"Come back to this dashboard in 1–2 business days if you've just applied, and your application isn't displayed.","Come back to this dashboard in 1–2 business days if you've just applied, and your application isn't displayed.",Vuelva a este portal mañana si acaba de presentar una solicitud y su solicitud aún no aparece.,Vuelve a este panel mañana si acabas de enviar tu solicitud y todavía no aparece.,
S2 - Portal Dashboard - Alert Applications Action,Apply for Summer EBT now,Apply for Summer EBT now,Aplique para Summer EBT ahora ,Aplica para Summer EBT ahora ,
S3 - Contact Preferences Update - Title,Your contact preferences,Your contact preferences,Tus preferencias de contacto,Tus preferencias de contacto,
S3 - Contact Preferences Update - Body,If you choose email or text we’ll continue to also mail notices to your physical address.,If you choose email or text we’ll continue to also mail notices to your physical address.,"Si eliges correo electrónico o mensaje de texto, también vamos a seguir enviando avisos por correo postal a tu dirección física.","Si eliges correo electrónico o mensaje de texto, también vamos a seguir enviando avisos por correo postal a tu dirección física.",
S3 - Contact Preferences Update - Label Language,Which language do you prefer to be contacted in?,Which language do you prefer to be contacted in?,¿En qué idioma prefieres que te contacten?,¿En qué idioma prefieres que te contacten?,
S3 - Contact Preferences Update - Label Contact Preference,Would you like to get emails about your Summer EBT account?,How do you prefer to be contacted?,¿Te gustaría recibir correos electrónicos sobre tu cuenta de Summer EBT?,¿Cómo prefieres que te contactemos?,
S3 - Contact Preferences Update - Label Email,What's your email address?,What's your email address?,¿Cómo prefieres que te contactemos?,¿Cuál es tu correo electrónico?,
S3 - Contact Preferences Update - Label Text Preference,Would you like get text messages about your Summer EBT account sent to ([999]) [999]-[9999]?,Would you like to get text messages about your DC SUN Bucks account?,¿Te gustaría recibir mensajes de texto sobre tu cuenta de Summer EBT al ([999]) [999]-[9999]?,¿Te gustaría recibir mensajes de texto sobre tu cuenta de DC SUN Bucks?,
S3 - Contact Preferences Update - Description Text Preference,This phone number needs to be able to receive text messages and can’t be changed.,This phone number needs to be able to receive text messages and can’t be changed.,Este número de teléfono tiene que poder recibir mensajes de texto y no se puede cambiar.,Este número de teléfono tiene que poder recibir mensajes de texto y no se puede cambiar.,
S3 - Contact Preferences Update - Label Phone,,What's the best phone number to text you?,¿Cuál es el mejor número de teléfono para enviarte mensajes de texto?,¿Cuál es el mejor número de teléfono para enviarte mensajes de texto?,
S3 - Contact Preferences Update - Description Phone,,This phone number needs to be able to receive text messages.,Este número de teléfono tiene que poder recibir mensajes de texto,Este número de teléfono tiene que poder recibir mensajes de texto,
S3 - Contact Preferences Update - Action Update Contact,Update contact preferences,Update contact preferences,Actualizar las preferencias de contacto,Actualizar las preferencias de contacto,
S3 - Parent Profile Update - Alert Profile Update,Your profile has been updated,Your profile has been updated,Tu perfil ha sido actualizado,Tu perfil ha sido actualizado,
S3 - Parent Profile Update - Title,Your Summer EBT Profile,Your Summer EBT Profile,Tu perfil de Summer EBT,Tu perfil de Summer EBT,
S3 - Parent Profile Update - Back,Back to portal home,Back to portal home,Regresar a la página de inicio del portal,Regresar a la página de inicio del portal,
S3 - Parent Profile Update - Heading Mailing Address,Your mailing address,Your mailing address,Tu dirección de correspondencia,Tu dirección de correspondencia,
S3 - Parent Profile Update - Label Preferred Mailing Address,Select your preferred mailing address,Select your preferred mailing address,Selecciona tu dirección de correspondencia preferida,Selecciona tu dirección de correspondencia preferida,
S3 - Parent Profile Update - Helper Preferred Mailing Address,You may add or edit addresses in this list using the links below.,You may add or edit addresses in this list using the links below.,Puedes agregar o editar las direcciones en esta lista usando los enlaces de abajo.,Puedes agregar o editar las direcciones en esta lista usando los enlaces de abajo.,
S3 - Parent Profile Update - Action Add Mailing Address,Add a new mailing address,Add a new mailing address,Agregar una nueva dirección de correspondencia,Agregar una nueva dirección de correspondencia,
S3 - Parent Profile Update - Edit Mailing Address,Edit mailing addresses,Edit mailing addresses,Editar la dirección de correspondencia,Editar la dirección de correspondencia,
S3 - Mailing Address Edit - Title,Edit your mailing addresses,Edit your mailing addresses,Edite tu dirección de correspondencia,Edite tu dirección de correspondencia,
S3 - Mailing Address Edit - Label Select Address,Select the address to edit,Select the address to edit,Selecciona la dirección que quieres editar,Selecciona la dirección que quieres editar,
S3 - Mailing Address Edit - Label Update or Delete,Do you want to update or delete this address?,Do you want to update or delete this address?,¿Quieres actualizar o borrar esta dirección?,¿Quieres actualizar o borrar esta dirección?,
S3 - Mailing Address Edit - Option Update,Update,Update,Actualizar,Actualizar,
S3 - Mailing Address Edit - Option Delete,Delete,Delete,Borarr,Borarr,
S3 - Confirm Delete Address - Title,Are you sure you want to delete this address?,Are you sure you want to delete this address?,¿Estás seguro de que quieres borrar esta dirección?,¿Estás seguro de que quieres borrar esta dirección?,
S3 - Parent Profile Update - Action Update Address,Update address preferences,Update address preferences,Actualizar las preferencias de direcciones,Actualizar las preferencias de direcciones,
S4 - Mailing Address Update - Title Your,Tell us where to safely send your mail,Tell us where to safely send your mail,Cuéntanos a qué dirección podemos enviarte tu correo de forma segura,Cuéntanos a qué dirección podemos enviarte tu correo de forma segura,
S4 - Mailing Address Update - Helper Street Address,Enter a street address shorter than 30 characters.,Enter a street address shorter than 30 characters.,Escribe una dirección de calle de menos de 30 caracteres.,Escribe una dirección de calle de menos de 30 caracteres.,
S4 - Mailing Address Update - Alert Body,"There was an issue with the address provided. If you can, please, enter a street address shorter than 30 characters.","There was an issue with the address provided. If you can, please, enter a street address shorter than 30 characters.","Hubo un problema con la dirección que ingresaste. Si puedes, escribe una dirección de calle de menos de 30 caracteres.","Hubo un problema con la dirección que ingresaste. Si puedes, escribe una dirección de calle de menos de 30 caracteres.",
S4 - Mailing Address Update - Alert Action,Contact us if you need more help.,Contact us if you need more help.,Contáctanos si necesitas más ayuda,Contáctanos si necesitas más ayuda.,
S4 - Mailing Address Update - Validation Street Address,Enter a street address shorter than 30 characters.,Enter a street address shorter than 30 characters.,Escribe una dirección de calle de menos de 30 caracteres.,Escribe una dirección de calle de menos de 30 caracteres.,
S4 - Abbreviated Address - Title,We abbreviated your address,We abbreviated your address,Abreviamos tu dirección,Abreviamos tu dirección,
S4 - Abbreviated Address - Body 1,We updated the street address to a format we can accept.,We updated the street address to a format we can accept.,Actualizamos la dirección de la calle a un formato que sí podemos aceptar,Actualizamos la dirección de la calle a un formato que sí podemos aceptar.,
S4 - Abbreviated Address - Body 2,Suggested address,Suggested address,Dirección sugerida,Dirección sugerida,
S4 - Abbreviated Address - Body 3,Address you entered,Address you entered,Dirección que ingresaste,Dirección que ingresaste,
S4 - Abbreviated Address - Body 4,"If the suggested address is correct, tap ""Use suggested address"". If you want to make a change to your address, tap ""Edit the address I entered"". Enter a street address shorter than 30 characters.","If the suggested address is correct, tap ""Use suggested address"". If you want to make a change to your address, tap ""Edit the address I entered"". Enter a street address shorter than 30 characters.","Si la dirección sugerida es correcta, toca “Usar la dirección sugerida”.
Si quieres hacer un cambio a tu dirección, toca “Editar la dirección que ingresé”.
Ingresa una dirección de calle con menos de 30 caracteres.","Si la dirección sugerida es correcta, toca “Usar la dirección sugerida”.
Si quieres hacer un cambio a tu dirección, toca “Editar la dirección que ingresé”.
Ingresa una dirección de calle con menos de 30 caracteres.",
S4 - Abbreviated Address - Action 1,Edit the address I entered,Edit the address I entered,Editar la dirección que ingresé,Editar la dirección que ingresé,
S4 - Abbreviated Address - Action 2,Use suggested address,Use suggested address,Usar la dirección sugerida,Usar la dirección sugerida,
S4 - Address Not Found - Title,Are you sure this address is correct?,Are you sure this address is correct?,¿Estás seguro que esta dirección es correcta?,¿Estás seguro que esta dirección es correcta?,
S4 - Address Not Found - Body,"We couldn't find the address you entered. To make sure we can send you mail or a Summer EBT card, please check the address. If it is correct, tap ""Use this address"".

If you want to make a change, tap ""Edit the address"".","We couldn't find the address you entered. To make sure we can send you mail or a Summer EBT card, please check the address. If it is correct, tap ""Use this address"".

If you want to make a change, tap ""Edit the address"".","No pudimos encontrar la dirección que ingresaste. Para asegurarnos de poder enviarte correo o tu tarjeta de Summer EBT, por favor revisa la dirección. Si es correcta, toca “Usar esta dirección”.

Si quieres hacer un cambio, toca “Editar la dirección”.","No pudimos encontrar la dirección que ingresaste. Para asegurarnos de poder enviarte correo o tu tarjeta de Summer EBT, por favor revisa la dirección. Si es correcta, toca “Usar esta dirección”.

Si quieres hacer un cambio, toca “Editar la dirección”.",
S4 - Address Not Found - Alert Title,Address you entered,Address you entered,Dirección que ingresaste,Dirección que ingresaste,
S4 - Address Not Found - Alert Action,Edit the address,Edit the address,Editar esta dirección,Editar esta dirección,
S4 - Address Not Found - Continue,Use this address,Use this address,Usar esta dirección,Usar esta dirección,
S4 - Address Not Found - Action Help,,Contact us,,Contáctanos ,
S4 - Suggested Address - Title,Check the address,Check the address,Confirmar la dirección,Confirmar la dirección,
S4 - Suggested Address - Body,"We updated the address you entered. If correct, use the suggested address.","We updated the address you entered. If correct, use the suggested address.","Hemos actualizado la dirección que ingresaste. Si es correcta, selecciona la dirección sugerida.","Hemos actualizado la dirección que ingresaste. Si es correcta, selecciona la dirección sugerida.",
S4 - Suggested Address - Label Select,Select the address to use,Select the address to use,Selecciona la dirección que quieres usar,Selecciona la dirección que quieres usar,
S5 - Bulk Order New Cards - Title,Do you want to request replacement Summer EBT cards to be sent to this address?,Do you want to request replacement Summer EBT cards to be sent to this address?,¿Quieres solicitar que las tarjetas Summer EBT de reemplazo sean enviadas a esta dirección?,¿Quieres solicitar que las tarjetas Summer EBT de reemplazo sean enviadas a esta dirección?,
S5 - Bulk Order New Cards - Body 1,We can send replacement cards if,We can send replacement cards if,Podemos enviar tarjetas de reemplazo si,Podemos enviar tarjetas de reemplazo si,
S5 - Bulk Order New Cards - Body 2,"You haven't received them in the mail after two weeks
Or you no longer have them","You haven't received them in the mail after two weeks
Or you no longer have them","No las has recibido por correo después de dos semanas
O yas no las tienes","No las has recibido por correo después de dos semanas
O ya no las tienes",
S5 - Bulk Order New Cards Confirm - Title,A few things to know before replacing Summer EBT cards,A few things to know before replacing Summer EBT cards,Algunas cosas a tener en cuenta antes de reemplazar las tarjetas de Summer EBT,Algunas cosas a tener en cuenta antes de reemplazar las tarjetas de Summer EBT,
S5 - Bulk Order New Cards Confirm - Body,"Once replacement cards are created, the previous cards will be permanently deactivated
Cards will arrive by mail in around 7-10 business days
Any remaining balance on the previous card will automatically be rolled over to the replacement card","Once replacement cards are created, the previous cards will be permanently deactivated
Cards will arrive by mail in around 5–7 days
You can check here to see when the card has been mailed
Any remaining balance on the previous card will automatically be rolled over to the replacement card","Una vez que se creen las tarjetas de reemplazo, las tarjetas anteriores se desactivarán permanentemente.
Las tarjetas llegarán por correo entre 5 y 7 días, aproximadamente.
Puedes verificar aquí cuándo se ha enviado la tarjeta.
Cualquier saldo restante en la tarjeta anterior se transferirá automáticamente a la tarjeta de reemplazo","Una vez que se creen las tarjetas de reemplazo, las tarjetas anteriores se desactivarán permanentemente.
Las tarjetas llegarán por correo entre 5 y 7 días, aproximadamente.
Puedes verificar aquí cuándo se ha enviado la tarjeta.
Cualquier saldo restante en la tarjeta anterior se transferirá automáticamente a la tarjeta de reemplazo",
S5 - Bulk Order New Cards Confirm - Summary Title,Card order summary,Card order summary,,,
S5 - Bulk Order New Cards Confirm - Summary Address,New cards will be mailed to the following address:,New cards will be mailed to the following address:,,,
S5 - Bulk Order New Cards Who - Title,Which cards need to be replaced?,Which cards need to be replaced?,,,
S5 - Bulk Order New Cards Who - Label Select Cards,Select which cards you want to replace,Select which cards you want to replace,Selecciona las tarjetas que deseas reemplazar,Selecciona las tarjetas que deseas reemplazar,
S5 - Bulk Order New Cards Who - Who's Card,[First name] [M.] [Last name]'s card,[First name] [M.] [Last name]'s card,,,
S5 - Bulk Order New Cards Who - Card Number,Card number: [9999] (last 4 digits),Card number: [9999] (last 4 digits),,,
S5 - Bulk Order New Cards Confirm - Action,Order cards,Order cards,,,
S6 - Replacement Card - Pre-title,Replace card ending in [9999],Replace card ending in [9999],,,
S6 - Replacement Card Address - Title,Do you want the new card mailed to this address?,Do you want the new card mailed to this address?,¿Deseas que el reemplazo de la tarjeta que termina en [9999] se envíe por correo a esta dirección?,¿Deseas que el reemplazo de la tarjeta que termina en [9999] se envíe por correo a esta dirección?,
S6 - Request Replacement Card FIS - Title,A few things to know before replacing Summer EBT cards,A few things to know before replacing cards,Algunas cosas a tener en cuenta antes de reemplazar las tarjetas de Summer EBT,Cosas que saber antes de solicitar una tarjeta de reemplazo,
S6 - Request Replacement Card FIS - Replace Card Body 1,,Call EBT Customer Service at (888) 328-2656 to request a replacement card to be sent to your address listed here.,,Llama a servicios al cliente de EBT al (888) 328-2656 para solicitar el envío de una tarjeta de reemplazo a la dirección que aparece aquí.,
S6 - Request Replacement Card FIS - Replace Card Body 2,,Hold on the line to select the lost card prompt and speak with an agent.,,Mantente en la línea para elegir la opción de tarjeta perdida y hablar con un representante.,
S6 - Request Replacement Card FIS - Replace Card Body 3,,,,,
S6 - Request Replacement Card FIS - Replace Card Body 4,,You can get a new DC SUN Bucks card if you need one. Go to the portal dashboard and tap “Request a replacement card” under the child’s name that has benefits issued to a DC SUN Bucks card.,,,
S6 - Request Replacement Card FIS - Action,,Go to the dashboard,,,
S6 - Request Replacement Card FIS - Keep Card,,Keep your card for next year. Benefits will be added to your new card.,,Guarda tu tarjeta para el próximo año. Tus beneficios serán agregados a tu nueva tarjeta.,
S6 - Request Replacement Card FIS - Tap to Call,,Tap to call EBT Customer Service,,Toca la pantalla para llamar a servicios al cliente de EBT,
S6 - Request Replacement Card FIS - Subtle Link,,I want a replacement for the card ending in [9999] mailed to a different address,,Quiero que la tarjeta que termina en [9999] me la reemplacen y la envíen por correo a una dirección diferente.,
S6 - Confirm Request Replacement Card - Title,A few things to know before replacing Summer EBT cards,A few things to know before replacing Summer EBT cards,Ingresa tu correo electrónico y te enviaremos un código para entrar a tu cuenta de DC SUN Bucks,,
