Content,English,,Español,,
S1 - Result - Streamlined Enrolled - Body,"Based on our records, we already have all the information we need to determine your child's Summer EBT eligibility for 2025.

2025 Summer EBT benefits were issued beginning in June 2025 and expire 122 days after issuance.","Based on our records, we already have all the information we need to determine your child's Summer EBT eligibility for 2026.

2026 Summer EBT benefits were issued beginning in June 2026 and expire 122 days after issuance.","Según nuestros registros ya tenemos toda la información que necesitamos para determinar la elegibilidad de Summer EBT de su hijo(a) para 2025.

Los beneficios de Summer EBT 2025 se emitieron a partir de junio de 2025 y vencen 122 días después de su emisión.","Según nuestros registros, ya tenemos toda la información que necesitamos para determinar la elegibilidad de Summer EBT de tu hijo(a) para 2026.

Los beneficios de Summer EBT 2026 se emitieron a partir de junio de 2026 y vencen 122 días después de su emisión.",
S1 - Result - Streamlined Enrolled - Body 1,The following children are already enrolled in Summer EBT for 2026.,The following children are *likely automatically enrolled for Summer EBT for 2026*.,Los siguientes niños ya están inscritos en Summer EBT para 2026.,Es *probable que los siguientes menores estén inscritos automáticamente* en Summer EBT para 2026,
S1 - Result - Streamlined Enrolled - Alert Title,Check the Summer EBT Portal to see where your enrolled children will receive their benefits.,Check the Summer EBT Portal to see where your children will receive their summer food benefits,Revisa el Portal de Summer EBT para ver dónde recibirán sus beneficios las niñas y los niños que ya están inscritos.,Revisa el portal de Summer EBT para ver dónde tus hijos recibirán sus beneficios de alimentos de verano,
S1 - Result - Streamlined Enrolled - Alert Body,"If they received the food benefit for a previous summer, we may issue their one-time $120 payment to the same Summer EBT card.

If your child is new to Summer EBT or their previous card needs to be replaced, we will mail a new card to the address we have on file.","If they received the food benefit for a previous summer, we may issue their one-time $120 payment to the same Summer EBT card.

If your child is new to Summer EBT or their previous card needs to be replaced, we will mail a new card to the address we have on file.","Si recibieron el beneficio de alimentos en un verano anterior, enviaremos su pago único de $120 a la misma tarjeta de Summer EBT.

Si tu hijo(a) es nuevo en Summer EBT o su tarjeta anterior ha sido desactivada, te enviaremos una nueva tarjeta por correo a la dirección que tenemos registrada.","Si recibieron el beneficio de alimentos el verano pasado, emitiremos su pago único de $120 a las mismas tarjetas de Summer EBT.

Si su hija o hijo es nuevo en Summer EBT o su tarjeta anterior ha sido desactivada, enviaremos una nueva tarjeta por correo a la dirección que tenemos registrada.",
S1 - Result - Streamlined Enrolled - Alert Action,"To check the mailing address we have on file, log in to the Summer EBT Portal","To check the mailing address we have on file, log in to the Summer EBT Portal","Para verificar la dirección de envío que tenemos registrada, inicia sesión en el portal de Summer EBT.","Para verificar la dirección de envío que tenemos registrada, inicia sesión en el portal de Summer EBT",
S1 - Result - Streamlined Enrolled - Body 2,We recommend logging into the Summer EBT portal to confirm,We recommend logging into the Summer EBT portal to confirm,Recomendamos iniciar sesión en el portal de Summer EBT para confirmar,Recomendamos iniciar sesión en el portal de Summer EBT para confirmar,
S1 - Result - Streamlined Enrolled - Body 3,Scroll down to view information we found about your other children.,Scroll down to view information we found about your other children.,Desliza hacia abajo para ver la información que encontramos sobre sus otros hijos.,Desliza hacia abajo para ver la información que encontramos sobre tus otros hijos.,
S1 - Result - Streamlined Enrolled - Action,Go to the Summer EBT Portal,Go to the Summer EBT Portal,Ir al Portal Summer EBT,Ir al Portal Summer EBT,
S1 - Result - Streamlined Enrolled - Card 1 Title,Enrolled in SNAP or Colorado Works (TANF)?,Enrolled in SNAP or Colorado Works (TANF)?,¿Está inscrito en el SNAP o Colorado Works (TANF)?,¿Está inscrito en el SNAP o Colorado Works (TANF)?,
S1 - Result - Streamlined Enrolled - Card 1 Body,"If your student has SNAP or Colorado Works (TANF), your Summer EBT will be loaded on the existing SNAP or TANF card on that date.","If your student has SNAP or Colorado Works (TANF), your Summer EBT will be loaded on the existing SNAP or TANF card on that date.","Si su estudiante tiene SNAP o Colorado Works (TANF), sus beneficios de Summer EBT se cargarán en la tarjeta de SNAP o TANF que ya tiene en esa fecha.","Si tu estudiante tiene SNAP o Colorado Works (TANF), sus beneficios de Summer EBT se cargarán en la tarjeta de SNAP o TANF que ya tiene en esa fecha.",
S1 - Result - Streamlined Enrolled - Card 2 Title,Do you have other children in your household?,Do you have other children in your household?,¿Tiene otros hijos en su grupo familiar?,¿Tiene otros hijos en su hogar?,
S1 - Result - Streamlined Enrolled - Card 2 Body,"To check if you need to submit a Summer EBT application for any other school-age children in your household, please provide their information by clicking on the button below.","To check if you need to submit a Summer EBT application for any other school-age children in your household, please provide their information by clicking on the button below.","Para verificar si necesita presentar una solicitud de Summer EBT para algún otro menor en edad escolar de su grupo familiar, proporcione su información haciendo clic en el botón a continuación.","Para verificar si necesita presentar una solicitud de Summer EBT para algún otro menor en su hogar que está en edad escolar, proporciona su información haciendo clic en el botón a continuación.",
S1 - Result - Streamlined Enrolled - Card 2 Action,Check another child,Check another child,Revisar otro(a) niño(a),Revisar otro(a) niño(a),
S1 - Result - Streamlined Enrolled - Steps Heading,Next steps,Next steps,próximos pasos,próximos pasos  ,
S1 - Result - None - Body 1,We don't have enough information for the following children.,We don't have enough information for the following children.,No tenemos suficiente información para los siguientes niños,No tenemos suficiente información para los siguientes niños,
S1 - Result - None - Body 2,We recommend logging into the Summer EBT portal to confirm if they are automatically enrolled.,We recommend logging into the Summer EBT portal to confirm if they are automatically enrolled.,Recomendamos iniciar sesión en el portal de Summer EBT para confirmar si estan automaticamente inscritos.,Recomendamos iniciar sesión en el portal de Summer EBT para confirmar si están automaticamente inscritos.,
S1 - Result - Error - Title,Something went wrong on our end,Something went wrong on our end,,,
S1 - Result - Error - Body,We aren’t able to able to share enrollment information for your children. You may try to check again later or continue with these next steps.,We aren’t able to able to share enrollment information for your children. You may try to check again later or continue with these next steps.,,,
S2 - Log In Disclaimer - Title,Access the Summer EBT portal,Log in to your Summer EBT account,Accede a tu cuenta de Summer EBT,Inicia sesión en tu cuenta de Summer EBT,
S2 - Log In Disclaimer - Log In Disclaimer - Body 1,"After tapping ""Log in"" you'll be redirected to log in using your myColorado® account. If you don't have a account, you'll be able to create one using your name, email address, phone number, and date of birth.","You can use the same login you use to access PEAK. Also, if you don't have an account, you can create one using your email address.","Después de tocar “Iniciar sesión”, se te redirigirá para entrar con tu cuenta de myColorado®. Si no tienes una cuenta, podrás crearla usando tu nombre, correo electrónico, número de teléfono y fecha de nacimiento.","Puedes usar el mismo inicio de sesión que utilizas para acceder al portal de PEAK. Si no tienes una cuenta, puedes crear una. ",
S2 - Log In Disclaimer - Log In Disclaimer - Body 2,Contact us if you need assistance logging in.,Contact us if you need assistance logging into your account.,Contáctanos si necesitas ayuda para iniciar sesión en tu cuenta.,Contáctanos si necesitas  ayuda para iniciar sesión en su cuenta. ,
S2 - Log In Disclaimer - Log In Disclaimer - Body 3,Summer EBT Call Center.,Summer EBT Call Center.,línea de servicio al cliente de la Summer EBT.,línea de servicio al cliente de Summer EBT.,
S2 - Portal Dashboard - Alert Address Updated,Your mailing address has been updated,Your mailing address has been updated,Tu dirección ha sido actualizada,Tu dirección ha sido actualizada,
S2 - Portal Dashboard - Alert Address Title,"A replacement for the card[s] ending in [[9999], [9999], and [9999],] will be sent to the following address","A replacement for the card[s] ending in [[9999], [9999], and [9999],] will be sent to the following address","Las tarjeta terminadas en [[9999], [9999], y [9999], van a ser remplazadas y enviadas a la siguiente dirección","Las tarjeta terminadas en [[9999], [9999], y [9999], van a ser remplazadas y enviadas a la siguiente dirección",
S2 - Portal Dashboard - Alert Address Body,New cards usually arrive in your mailbox within 7–10 business days. Check back here in 1–2 business days to see your updated card details.,New cards usually arrive in your mailbox within 7–10 business days. Check back here in 1–2 business days to see your updated card details.,Las tarjetas nuevas generalmente llegan por correo en un plazo de 7 a 10 días hábiles. Vuelve a consultar aquí en 1 a 2 días hábiles para ver la información actualizada de tu tarjeta.,Las tarjetas nuevas generalmente llegan por correo en un plazo de 7 a 10 días hábiles. Vuelve a consultar aquí en 1 a 2 días hábiles para ver la información actualizada de tu tarjeta.,
S2 - Portal Dashboard - Alert Contact Updated,Your contact preferences have been updated,Your contact preferences have been updated,Se han actualizado tus preferencias de contacto,Se han actualizado tus preferencias de contacto,
S2 - Portal Dashboard - Alert Address Update Error,There was an issue updating your mailing address. Please try again later.,There was an issue updating your mailing address. Please try again later.,Hubo un problema al actualizar su dirección postal. Vuelve a intentarlo más tarde.,Hubo un problema al actualizar tu dirección postal. Vuelve a intentarlo más tarde.,
S2 - Portal Dashboard - Alert Contact Update Error,There was an issue updating your contact preferences. Please try again later.,There was an issue updating your contact preferences. Please try again later.,Hubo un problema al actualizar tus preferencias de contacto. Vuelve a intentarlo más tarde.,Hubo un problema al actualizar tus preferencias de contacto. Vuelve a intentarlo más tarde.,
S2 - Portal Dashboard - Alert Check Address Title,Is your address correct?,Is your address correct?,Revisa tu dirección,Revisa tu dirección,
S2 - Portal Dashboard - Alert Check Address Body,Please check your preferred mailing address to make sure you can receive Summer EBT cards and other mail from us.,Please check your preferred mailing address to make sure you can receive Summer EBT cards and other mail from us.,"Por favor, revisa tu dirección postal preferida para asegurarte de que puedas recibir las tarjetas Summer EBT y otros envíos por correo de nuestra parte.","Por favor, revisa tu dirección postal preferida para asegurarte de que puedas recibir las tarjetas Summer EBT y otros envíos por correo de nuestra parte.",
S2 - Portal Dashboard - Alert Check Address Link 1,"Yes, this is my address","Yes, this is my address","Si, esta es mi dirección postal","Si, esta es mi dirección postal",
S2 - Portal Dashboard - Alert Check Address Link 2,"No, change my mailing address","No, change my mailing address","No, cambiar mi dirección postal","No, cambiar mi dirección postal",
S2 - Portal Dashboard - Logout,Logout,Logout,Cerrar sesión,Cerrar sesión,
S2 - Portal Dashboard - Action Navigation - Lead,I want to,I want to,Quiero,Quiero,
S2 - Portal Dashboard - Action Navigation - Check Existing Cards,Check existing cards,Check existing cards,Revisar mis tarjetas existentes,Revisar mis tarjetas existentes,
S2 - Portal Dashboard - Action Navigation - Order replacement cards,Request new cards,Request new cards,Pedir tarjetas de reemplazo,Pedir tarjetas de reemplazo,
S2 - Portal Dashboard - Action Navigation - Change my mailing address,Change my mailing address,Change my mailing address,Cambiar mi dirección de correspondencia,Cambiar mi dirección de correspondencia,
S2 - Portal Dashboard - Action Navigation - Change my contact information,Change my contact information,Change my contact information,Cambiar mi información de contacto,Cambiar mi información de contacto,
S2 - Portal Dashboard - Action Navigation - Check existing applications,Check existing applications,Check existing applications,Revisar solicitudes pendientes,Revisar solicitudes pendientes,
S2 - Portal Dashboard - Action Navigation - Activate Card,Activate a card,Activate a card,Activar una tarjeta,Activar una tarjeta,
S2 - Portal Dashboard - Action Navigation - Apply,Apply for Summer EBT,Apply for Summer EBT,Enviar una solicitud para la Summer EBT,Aplicar para Summer EBT,
S2 - Portal Dashboard - Profile Table - Heading Status,Status,Status,Estado,Estado,
S2 - Portal Dashboard - Profile Table - Status Enrolled,Enrolled,Enrolled,Inscrito,Inscrito ,
S2 - Portal Dashboard - Profile Table - Status Application In-Progress,Application in-progress,Application in-progress,Solicitud en proceso,Aplicación en proceso,
S2 - Portal Dashboard - Profile Table - Status Application Denied,Application denied,Application denied,Solicitud rechazada,Aplicación rechazada,
S2 - Portal Dashboard - Profile Table - Status Enrolled Description,Your children are enrolled because we have enough information to confirm their eligibility.,Your children are enrolled because we have enough information to confirm their eligibility.,Tus hijos están inscritos porque tenemos suficiente información para confirmar que califican.,Tus hijos están inscritos porque tenemos suficiente información para confirmar que califican.,
S2 - Portal Dashboard - Profile Table - Status Check Address,Check mailing address,Check mailing address,Revisar dirección postal,Revisar dirección postal,
S2 - Portal Dashboard - Profile Table - Heading Contact,Your preferred contact,Your preferred contact,Su método de contacto preferido,Tu método de contacto preferido,
S2 - Portal Dashboard - Profile Table - Contact Emails On,Getting emails at [email]@[domain].,Getting emailed notices at [email]@[domain].,Recibiendo avisos por correo electrónico a [email]@[domain],Recibiendo avisos por correo electrónico a [email]@[domain],
S2 - Portal Dashboard - Profile Table - Contact Emails Off,Not getting emails.,Getting mailed notices to my physical address.,No está recibiendo correo electrónico,Recibiendo avisos por correo postal a mi dirección física.,
S2 - Portal Dashboard - Profile Table - Contact Text On,Getting text messages at ([999]) 999-9999.,Getting text messages at ([999]) 999-9999.,Recibiendo mensajes de texto al ([999]) 999-9999.,Recibiendo mensajes de texto al ([999]) 999-9999.,
S2 - Portal Dashboard - Profile Table - Contact Text Off,Not getting text messages.,Not getting text messages.,No está recibiendo mensajes de texto,No está recibiendo mensajes de texto,
S2 - Portal Dashboard - Profile Table - Heading Address,Your mailing address,Your mailing address,Tu dirección de correspondencia,Tu dirección de correspondencia,
S2 - Portal Dashboard - Profile Table - Update your profile,Update your profile,Update your profile,Actualizar tu perfil,Actualiza tu perfil,
S2 - Portal Dashboard - Profile Table - Physical Mail,Physical Mail,Physical Mail,Correo físico,Correo físico,
S2 - Portal Dashboard - Profile Table - Action Change Address,Change my mailing address,Change my mailing address,Cambiar mi dirección de correspondencia,Cambiar mi dirección de correspondencia,
S2 - Portal Dashboard - Profile Table - Action Change Contact,Change my contact preferences,Change my contact preferences,Cambiar mi información de contacto,Cambiar mi información de contacto,
S2 - Portal Dashboard - Section - Cards Heading,Summer EBT Cards,Summer EBT Cards,Tarjetas Summer EBT,Tarjetas Summer EBT,
S2 - Portal Dashboard - Section - Cards Body,Here are your children's Summer EBT cards we have on file.,Here are your children's Summer EBT cards we have on file.,Estas son las tarjetas Summer EBT de tus hijos que tenemos registradas. ,Estas son las tarjetas Summer EBT de tus hijos que tenemos registradas. ,
S2 - Portal Dashboard - Section - Cards Alert Body,"If your child is eligible for Summer EBT through SNAP or Colorado Works (TANF) participation, they will not have a Summer EBT card. Their benefits will be loaded onto the SNAP or TANF EBT card.","If your child is eligible for Summer EBT through SNAP or Colorado Works (TANF) participation, they will not have a Summer EBT card. Their benefits will be loaded onto the SNAP or TANF EBT card.","Si tu hijo califica para Summer EBT a través de la participación en SNAP o Colorado Works (TANF), no tendrá una tarjeta Summer EBT. Sus beneficios se cargarán en la tarjeta EBT de SNAP o TANF.","Si tu hijo califica para Summer EBT a través de la participación en SNAP o Colorado Works (TANF), no tendrá una tarjeta Summer EBT. Sus beneficios se cargarán en la tarjeta EBT de SNAP o TANF.",
S2 - Portal Dashboard - Card Table - Heading SEBT ID,Summer EBT ID,Summer EBT ID,ID Summer EBT,ID Summer EBT,
S2 - Portal Dashboard - Card Table - Heading Issued,Benefit issue date,Benefit issue date,Beneficios asignados,Beneficios asignados,
S2 - Portal Dashboard - Card Table - Heading Exp Date,Benefit expiration date,Benefit expiration date,Fecha de vencimiento del beneficio,Fecha de vencimiento del beneficio,
S2 - Portal Dashboard - Card Table - Heading Card Type,Benefit issued to,Benefit issued to,Beneficios asignados a,Beneficios asignados a,
S2 - Portal Dashboard - Card Table - Types,[Summer EBT] Card,[Summer EBT] Card,Tarjeta [Summer EBT],Tarjeta [Summer EBT],
S2 - Portal Dashboard - Card Table - Types Co-loaded,[SNAP EBT/TANF EBT] Card,Household [SNAP EBT/TANF EBT] Card,Tarjeta [SNAP EBT/TANF EBT] del hogar,Tarjeta [SNAP EBT/TANF EBT]  del hogar ,
S2 - Portal Dashboard - Card Table - Type SEBT,Summer EBT Card,Summer EBT Card,Tarjeta Summer EBT,Tarjeta Summer EBT,
S2 - Portal Dashboard - Card Table - Type SNAP,SNAP EBT Card,Household SNAP EBT Card,Tarjeta SNAP EBT del hogar,Tarjeta SNAP EBT del hogar,
S2 - Portal Dashboard - Card Table - Type TANF,Colorado Works (TANF) EBT Card,Household Colorado Works (TANF) EBT Card,Tarjeta Colorado Works (TANF) EBT del hogar,Tarjeta Colorado Works (TANF) EBT del hogar,
S2 - Portal Dashboard - Card Table - Heading Card Number,Card number,Card number,Número de tarjeta,Número de tarjeta,
S2 - Portal Dashboard - Card Table - Last Four Digits,[9999] (last 4 digits),[9999] (last 4 digits),[9999] (últimos 4 dígitos),[9999] (últimos 4 dígitos),
S2 - Portal Dashboard - Card Table - Heading Card Status,Card status,Card status,Estado de la tarjeta,Estado de la tarjeta,
S2 - Portal Dashboard - Card Table - Heading Mailing address,Mailing address,Mailing address,Dirección de correspondencia,Dirección de correspondencia,
S2 - Portal Dashboard - Card Table - Status Requested,Requested on [MM/DD/YYYY],Requested on [MM/DD/YYYY],Solicitada el [DD/MM/YYYY],Solicitada [DD/MM/YYYY],
S2 - Portal Dashboard - Card Table - Status Issued,Issued on [MM/DD/YYYY],Issued on [MM/DD/YYYY],Emitida el [DD/MM/YYYY],Emitida el [DD/MM/YYYY],
S2 - Portal Dashboard - Card Table - Status Mailed,Mailed on [MM/DD/YYYY] to,Mailed on [MM/DD/YYYY],Enviado por correo el [DD/MM/YYYY],Enviada por correo el [DD/MM/YYYY],
S2 - Portal Dashboard - Card Table - Status Active,Active,Active,Activa,Activa,
S2 - Portal Dashboard - Card Table - Status Deactivated,Inactive,Deactivated,Inactiva,Desactivada,
S2 - Portal Dashboard - Card Table - Status Inactive,Inactive,Inactive,Inactiva,Inactiva,
S2 - Portal Dashboard - Card Table - Status Frozen,Frozen,Frozen,Congelada,Congelada,
S2 - Portal Dashboard - Card Table - Status Undeliverable,Undeliverable,Undeliverable,No se pudo entregar,No se pudo entregar,
S2 - Portal Dashboard - Card Table - Status Message Requested 1,We've requested a new Summer EBT card that will arrive in the mail within 4–7 weeks. Check back here to see when the card has been mailed.,We've requested a new Summer EBT card that will arrive in the mail within 2–3 weeks. Check back here to see when the card has been mailed.,Hemos solicitado una nueva tarjeta de DC SUN Bucks que llegará por correo en un plazo de 2 a 3 semanas. Regresa aquí para ver cuándo se ha enviado la tarjeta.,Hemos solicitado una nueva tarjeta de Summer EBT que llegará por correo en un plazo de 2 a 3 semanas. Regresa aquí para ver cuándo se envió la tarjeta.,
S2 - Portal Dashboard - Card Table - Status Message Requested 2,A replacement card will arrive in the mail in around 7–10 business days. Check back here to see when the replacement card has been mailed.,A replacement card will arrive in the mail in around 5–7 days. The card should be mailed within 2 days. Check back here to see when the replacement card has been mailed.,Una tarjeta de reemplazo llegará por correo en aproximadamente 5 a 7 días. La tarjeta debería ser enviada dentro de 2 días. Regresa aquí para ver cuándo se ha enviado la tarjeta de reemplazo.,Una tarjeta de reemplazo llegará por correo en aproximadamente 5 a 7 días. La tarjeta debería ser enviada dentro de 2 días. Regresa aquí para ver cuándo se envió la tarjeta de reemplazo.,
S2 - Portal Dashboard - Card Table - Status Message Mailed,"After the new card is mailed, it should arrive in around 7–10 business days. If it doesn't arrive after two weeks, you can request a replacement card.

Once you receive the card, call EBT Customer Service at (888) 328-2656 to set the card's PIN and activate it. When asked to ""enter your date of birth,"" enter the child's birthdate, not your own.","After the new card is mailed, it should arrive in around 5–7 days. If it doesn't arrive after two weeks, you can request a replacement card.","Una vez que se envíe por correo la nueva tarjeta, debería llegar en un plazo de 5 a 7 días. Si no llega después de dos semanas, puedes solicitar una tarjeta de reemplazo.","Una vez que se envíe por correo la nueva tarjeta, debería llegar en un plazo de 5 a 7 días. Si no llega después de dos semanas, puedes solicitar una tarjeta de reemplazo.",
S2 - Portal Dashboard - Card Table - Status Message Active,"This card has been sent to you. It is ready to make purchases as soon as you set the PIN. When the card arrives, call EBT Customer Service at (888) 328-2656 to set the card's PIN.

When asked to enter the date of birth, enter your child’s birthdate and use the format MM-DD-YYYY.

When asked to ""enter the primary cardholder's"" ZIP Code, enter the ZIP Code of the address your card was mailed to.","This card has been sent to you. It is ready to make purchases as soon as you set the PIN. When the card arrives, call EBT Customer Service at (888) 328-2656 to set the card's PIN.

When asked to enter the date of birth, enter your child’s birthdate and use the format MM-DD-YYYY.

When asked to ""enter the primary cardholder's"" ZIP Code, enter the ZIP Code of the address your card was mailed to.","Esta tarjeta ya se te envió. Está lista para hacer compras en cuanto le pongas el PIN. Cuando llegue la tarjeta, llama al Servicio al Cliente de EBT al (888) 328-2656 para configurar el PIN de la tarjeta.

Cuando te pidan ingresar la fecha de nacimiento, escribe la fecha de nacimiento de tu hijo usando el formato DD-MM-YYYY (día-mes-año).

Cuando te pidan “ingresar el código postal del titular principal de la tarjeta”, ingresa el código postal de la dirección a la que se envió por correo tu tarjeta.","Esta tarjeta ya se te envió. Está lista para hacer compras en cuanto le pongas el PIN. Cuando llegue la tarjeta, llama al Servicio al Cliente de EBT al (888) 328-2656 para configurar el PIN de la tarjeta.

Cuando te pidan ingresar la fecha de nacimiento, escribe la fecha de nacimiento de tu hijo usando el formato DD-MM-YYYY (día-mes-año).

Cuando te pidan “ingresar el código postal del titular principal de la tarjeta”, ingresa el código postal de la dirección a la que se envió por correo tu tarjeta.",For version in Español the format is DD-MM-YYYY
