Content,English,,Español,,
S1 - Landing Page - Title,Get $120 in summer food benefits for your child,Get a one-time payment of $120 in summer food benefits for your child,Obtén un pago único de $120 en beneficios de alimentos de verano para tu hija o hijo.,Obtenga un pago único de $120 para pagar la comida de su estudiante este verano,
S1 - Landing Page - Body,"Each eligible child can receive **one $120 payment** for summer groceries.

Most eligible children get their payment automatically. Some need to submit an application. 

We can tell if you should apply for your child. Tap ""Do I need to apply?"" and enter your child's information.","Each eligible child can receive a *one-time payment of $120*. Families may use the money to pay for groceries during the summer months. 

Some eligible families are automatically enrolled, and some need to submit an application. We can recommend whether you should apply for your child. Tap ""Do I need to apply?"" and enter your child's information.","Cada niño que califique puede recibir un pago de $120 para comprar comida en el verano.

La mayoría de los niños que califican reciben su pago automáticamente. Algunas familias necesitan aplicar.

Podemos decirte si debes aplicar para tu hija o tu hijo. Toca “¿Necesito aplicar?” y escribe la información de tu niña o niño.","Cada estudiante que califica puede recibir un *pago único de $120*. Este dinero se puede usar para comprar alimentos durante los meses de verano. 

Algunas familias elegibles son inscritas automátocamente y otras tienen que aplicar. Podemos recomendarle si necesita aplicar. Toque “¿Necesito aplicar?” e ingrese la información de su hijo/a.  ",
S1 - Landing Page - Action,Apply now,Do I need to apply?,Aplica ahora,¿Necesito aplicar?,
S1 - Landing Page - Action Español,Aplica ahora,¿Necesito aplicar?,Apply now,Do I need to apply?,
S1 - Landing Page - Action Amharic,,ማመልከት አለብኝ,,ማመልከት አለብኝ,
S1 - Landing Page - Action Subtext,Safe and secure,Safe and secure,Seguro y protegido,Seguro y protegido,
S1 - Landing Page - Accordion Title,How do I know if my child can get Summer EBT?,How do I know if my child can get Summer EBT?,¿Cómo sé si mi hijo califica para recibir Summer EBT?,¿Cómo sé si mi hijo califica para recibir Summer EBT?,
S1 - Landing Page - Body 2,Any child could qualify for **one** of these reasons:,Children may be automatically enrolled if we have information to confirm their eligibility. This usually happens for one of the following reasons:,"Cualquier niña o niño puede calificar por **una** de estas razones:
",Es posible que inscribamos automáticamente a tus hijos/as si contamos con información para confirmar su elegibilidad. Esto puede suceder por alguno de los siguientes motivos:,
S1 - Landing Page - Body 3,"They are between ages 6 and 17. And they get SNAP (food stamps), Colorado Works (TANF), or Medicaid
Or they are temporarily unhoused or in foster care
Or they get free or low-cost meals at school, and they are enrolled in a school that participates in the National School Lunch Program (NSLP)","They are between ages 6 and 17. And they get SNAP (food stamps), Colorado Works (TANF), Medicaid, or the Food Distribution Program on Indian Reservations (FDPIR)
Or they are temporarily unhoused or in foster care
Or they get free or low-cost meals at school, and they are enrolled in a school that participates in the National School Lunch Program (NSLP)","Tiene entre 6 y 17 años y recibe SNAP (cupones de alimentos), Colorado Works (TANF) o Medicaid
O, está temporalmente sin hogar o en hogar de acogida (foster care)
O, recibe comidas gratuitas o a bajo costo en la escuela
O, está inscrito/a en una escuela que participa en el Programa Nacional de Almuerzos Escolares (NSLP)","Tienen entre 6 y 17 años y reciben SNAP (cupones de alimentos), Colorado Works (TANF), Medicaid o el Programa de Distribución de Alimentos en Reservas Indígenas (FDPIR)
O, están temporalmente sin hogar o en hogar de acogida (foster care)
O, reciben comidas gratuitas o a bajo costo en la escuela
O, están inscritos/as en una escuela que participa en el Programa Nacional de Almuerzos Escolares (NSLP)",
S1 - Landing Page - Body 4,"Children may be automatically enrolled if we have enough information to confirm their eligibility. 

If not, parents or guardians can apply to see if they qualify. Tap [""Apply now""](link) to find out if you should apply for your child.","But, children who are not automatically enrolled may still be able to get the benefit. Parents or guardians should fill out an application to see if they qualify. Tap [""Apply now""](link) to see if you need to apply for your child.","Las niñas y los niños pueden inscribirse automáticamente si tenemos suficiente información para confirmar que califican.

Si no, las madres, padres, cuidadores, o tutores pueden enviar una solicitud para ver si califican. Toca [""Aplica ahora""] (link)  para saber si debes aplicarpara tu hija o hijo.","Sin embargo, si tus hijos/as no quedan inscritos/as automáticamente, aún podrían recibir el beneficio. Llena una solicitud para ver si califican. Toca [""Aplica ahora""] (link) para saber si necesitas aplicar.",
S1 - Disclaimer - Title,What to know before we begin,What to know before we begin,Lo que debes saber antes de comenzar,Lo que debes saber antes de comenzar,
S1 - Disclaimer - Body 1,"First, we'll check if your child is already enrolled.",This is not an application for Summer EBT.,"Primero, verificaremos si tu hija o tu hijo ya está inscrito.",Esto NO es una aplicación para Summer EBT,
S1 - Disclaimer - Body 2,"If they are, you'll be able to confirm where and when your card will be mailed to you. If they aren't, we'll share the application form with you to fill out.",This tool will help you learn if your children are potentially eligible for Summer EBT and if you should apply.,"Si ya lo está, podrás confirmar a dónde y cuándo te enviarán la tarjeta por correo. Si no lo está, te daremos el formulario con la aplicación para que lo llenes.",Esta herramienta te ayudará a saber si tus hijos podrían calificar para Summer EBT y si debes aplicar.,
S1 - Disclaimer - Body 3,The information you provide will be kept private and secure.,The information you provide will be kept private and secure.,La información que nos proporciones se mantendrá privada y segura.,La información que nos proporciones se mantendrá privada y segura.,
S1 - Disclaimer - Body 4,Using this tool will not affect your potential Summer EBT benefits or other benefits you get.,Using this tool will not affect your potential Summer EBT benefits or other benefits you get.,Usar esta herramienta no afectará tus posibles beneficios de Summer EBT ni otros beneficios que recibes.,Usar esta herramienta no afectará tus posibles beneficios de Summer EBT ni otros beneficios que recibes.,
S1 - Personal Information - Title,Check if your child is already enrolled in Summer EBT,Check if your child needs to apply for Summer EBT,Comprueba si tu hijo(a) necesita aplicar para recibir los beneficios de Summer EBT,Comprueba si tu hijo(a) necesita aplicar para recibir los beneficios de Summer EBT,"Keeping ""auto-enrolled"" in English keeping it as a more descriptive heading ""needs to apply"" in Spanish"
S1 - Personal Information - Body,Please provide your student's information in the required fields below. This tool will check if your child is automatically enrolled to receive benefits.,Please provide your student's information in the required fields below. This tool will check if your child is automatically enrolled to receive benefits.,Proporciona la información de tu estudiante en los campos obligatorios. Esta herramienta comprobará si tu hijo(a) necesita aplicar para recibir los beneficios.,Proporciona la información de tu estudiante en los campos obligatorios. Esta herramienta comprobará si tu hijo(a) queda inscrito de forma automática para recibir los beneficios.,
S1 - Personal Information - Label Birthdate,Birthdate,Birthdate,Fecha de nacimiento,Fecha de nacimiento,
S1 - Personal Information - Label Month,Month,Month,Mes,Mes,
S1 - Personal Information - Label Day,Day,Day,Día,Día,
S1 - Personal Information - Label Year,Year,Year,Año,Año,
S1 - Confirm Personal Information - Title,Here's the information we have so far,Here's the information we have so far,Aquí está la información que tenemos hasta ahora.,Aquí está la información que tenemos hasta ahora,
S1 - Confirm Personal Information - Body,"Review your child(ren)'s information below. You may add another child to see if they need to apply, too. Tap ""Submit"" if you've finished adding children.","Review your child(ren)'s information below. You may add another child to see if they need to apply, too. Tap ""Submit"" if you've finished adding children.","Revisa la información de tu(s) hijo(s) a continuación. Puedes agregar otro hijo para ver si también debe aplicar. Toqua ""Enviar"" si ya terminaste de agregar a tus hijos.","Revisa la información de tu(s) hijo(s) a continuación. Puedes agregar otro hijo para ver si también debe aplicar. Toqua ""Enviar"" si ya terminaste de agregar a tus hijos.",
S1 - Confirm Personal Information - Table Name Heading,Name,Name,Nombre,Nombre,
S1 - Confirm Personal Information - Table Name Value,[First name] [M.] [Last name],[First name] [M.] [Last name],[Nombre] [Inicial del segundo nombre] [Apellido],[Nombre] [Inicial del segundo nombre] [Apellido],
S1 - Confirm Personal Information - Table Birthdate Heading,Birthdate,Birthdate,Fecha de nacimiento,Fecha de nacimiento,
S1 - Confirm Personal Information - Table Birthdate Value,"[Month], [Day] [Year]","[Month], [Day] [Year]",[día] de [mes] de [año],[día] de [mes] de [año],
S1 - Confirm Personal Information - Table Action,Update this child's information,Update this child's information,Actualizar la información de este menor,Actualizar la información de este menor,
S1 - Confirm Personal Information - Action Add,Add another child,Add another child,Agreguar otro niño,Agregar otro niño,
S1 - Optional ID Information - Title,We checked our records and need more information to see if [First name] [M.] [Last name] is enrolled,We checked our records and need more information to see if this child can get Summer EBT,Revisamos nuestros registros y necesitamos más información para saber si [First name] [M.] [Last name] necesita aplicar.,Revisamos nuestros registros y necesitamos más información para ver si este niño puede recibir Summer EBT,
S1 - Optional ID Information - Body,"We suggest providing any of the child's State Assigned Student ID (SASID), SNAP, Colorado Works (TANF), or Medicaid number if you have them. We can give you a better answer about whether they are pre-approved.","We suggest providing any of the child's Student ID, SNAP, Colorado Works (TANF), or Medicaid number if you have them. We can give you a better answer about whether they are pre-approved.","Te sugerimos que proporciones, si los tienes, cualquiera de estos números de tu hijo(a): su número de identificación de estudiante asignado por el estado (SASID), SNAP, Colorado Works (TANF) o Medicaid. Así podremos darte una mejor respuesta sobre si necesitan aplicar.","Sugerimos que proporciones el número de identificación estudiantil, SNAP, Colorado Works (TANF) o Medicaid del niño, si los tienes. Así podemos darte una mejor respuesta sobre si ya están preaprobados.",
S1 - Optional ID Information - Label Which ID,Which ID number can you provide? *,Which ID number can you provide? *,¿Cuál número de identificación puedes proporcionar? *,¿Cuál número de identificación puedes proporcionar? *,
S1 - Optional ID Information - Option Student ID,State Assigned Student ID (SASID),Unique Student ID,Número de identificación de estudiante asignado por el estado (SASID),Identificación de estudiante única,
S1 - Optional ID Information - Option Helper Student ID,This is a unique 10-digit number assigned to your child. Their school may be able to provide it if you do not know it.,This number is the Universal Student ID Number for your child.,Este es un número único de 10 dígitos asignado a tu hijo(a). Su escuela puede dártelo si no lo conoces.,Este es el número de identificación universal de estudiante de tu hijo(a).,
S1 - Optional ID Information - Option Medicaid ID,Medicaid identification number (CIN / I-CIN),Medicaid identification number (CIN / I-CIN),Número de identificación de Medicaid (CIN / I-CIN),Número de identificación de Medicaid (CIN / I-CIN),
S1 - Optional ID Information - Option Helper Medicaid ID,This number can be found on your child's Medicaid program notices and is typically 7 or 8 digits long.,This number can be found on your child's Medicaid program notices and is typically 7 or 8 digits long.,Este número se puede encontrar en los avisos del programa Medicaid de su hijo(a) y suele tener entre 7 y 8 dígitos.,Este número se puede encontrar en los avisos del programa Medicaid de tu hijo(a) y suele tener entre 7 y 8 dígitos.,
S1 - Optional ID Information - Option SNAP Case Number,SNAP case number,SNAP case number,Número de caso de SNAP,Número de caso de SNAP,
S1 - Optional ID Information - Option Helper SNAP Case Number,This number can be found on your child's SNAP program notices and is typically 7 or 8 digits long.,This number can be found on your child's SNAP program notices and is typically 7 or 8 digits long.,Este número se puede encontrar en los avisos del programa SNAP de su hijo(a) y suele tener 7 u 8 dígitos.,Este número se puede encontrar en los avisos del programa SNAP de tu hijo(a) y suele tener 7 u 8 dígitos.,
S1 - Optional ID Information - Option TANF ID,Colorado Works (TANF) identification number,Colorado Works (TANF) identification number,Número de identificación de Colorado Works (TANF),Número de identificación de Colorado Works (TANF),
S1 - Optional ID Information - Option Helper TANF ID,This number can be found on your child's Colorado Works (TANF) program notices and is typically 7 or 8 digits long.,This number can be found on your child's Colorado Works (TANF) program notices and is typically 7 or 8 digits long.,Este número se puede encontrar en los avisos del programa Colorado Works (TANF) de su hijo(a) y suele tener 7 u 8 dígitos.,Este número se puede encontrar en los avisos del programa Colorado Works (TANF) de tu hijo(a) y suele tener 7 u 8 dígitos.,
S1 - Optional ID Information - Label Enter Student ID,State Assigned Student ID (SASID),Enter their Unique Student ID,Número de identificación de estudiante asignado por el estado (SASID),Ingresa su ID de estudiante único,
S1 - Optional ID Information - Label Enter Medicaid ID,Enter their Medicaid identification number (CIN / I-CIN),Enter their Medicaid identification number (CIN / I-CIN),Ingrese su número de identificación de Medicaid (CIN / I-CIN),Ingresa su número de identificación de Medicaid (CIN / I-CIN),
S1 - Optional ID Information - Label Enter SNAP Case Number,Enter their SNAP case number,Enter their SNAP case number,Ingrese su número de caso SNAP,Ingresa su número de caso SNAP,
S1 - Optional ID Information - Label Enter TANF ID,Enter their Colorado Works (TANF) identification number,Enter their Colorado Works (TANF) identification number,Ingrese su número de identificación Colorado Works (TANF),Ingresa su número de identificación Colorado Works (TANF),
S1 - Optional ID Information - Alert Action Log Into Portal,Contact us if you can't provide any of the suggested ID numbers.,Contact us if you can't provide any of the suggested ID numbers.,Contáctanos si no puedes proporcionar ninguno de los números de identificación sugeridos.,Contáctanos si no puedes proporcionar ninguno de los números de identificación sugeridos.,
S1 - Result - Title,Here's the information we found,Here's the information we found,Aquí está la información que encontramos,Aquí está la información que encontramos,
S1 - Result - Apply for SEBT - Title,We recommend that you fill out an application for this child,We recommend that you fill out an application for this child,"Para ayudarnos a decidir, le recomendamos que complete una solicitud para este menor","Para ayudarnos a decidir, te recomendamos que completes una solicitud para este menor",
S1 - Result - Apply for SEBT - Body,Children may not be automatically enrolled because we don't have enough information to determine their eligibility. But parents or guardians can apply to see if they are eligible.,Children may not be automatically enrolled because we don't have enough information to determine their eligibility. But parents or guardians can apply to see if they are eligible.,"A veces los niños no se inscriben automáticamente porque no tenemos toda la información necesaria para ver si pueden participar. Sin embargo, igual podrían calificar.","A veces los niños no se inscriben automáticamente porque no tenemos toda la información necesaria para ver si pueden participar. Sin embargo, igual podrían calificar.",
S1 - Result - Apply for SEBT - Body 1,The following children are NOT enrolled in Summer EBT for 2026,The following children *may not be automatically enrolled*.,Las siguientes niñas y los siguientes niños NO están inscritos en Summer EBT para 2026.,Es posible que los siguientes menores *no estén inscritos automáticamente*.,
S1 - Result - Apply for SEBT - Action Apply,Continue your Summer EBT application for children who aren't enrolled.,We recommend submitting a Summer EBT application for them,Continúa tu aplicación de Summer EBT para los niños que no están inscritos.,Recomendamos presentar una aplicación de Summer EBT para ellos,
S1 - Result - Apply for SEBT - Body 2,"Children may not be automatically enrolled because we don't have enough information to determine their eligibility. If not, parents or guardians can apply to see if they qualify.","Children may not be automatically enrolled because we do not have enough information to determine their eligibility. However, they may still be eligible.","Es posible que las niñas y los niños no queden inscritos automáticamente porque no tenemos suficiente información para determinar si califican. Si es así, las madres, padres, cuidadores, o tutores pueden enviar una aplicación para ver si califican.","Es posible que los menores no estén inscritos automáticamente porque no tenemos suficiente información para determinar su elegibilidad. Sin embargo, aún podrían ser elegibles.",
S1 - Result - Apply for SEBT - Body 3,"To receive food benefits for Summer 2026, you must apply by [Date]. Applying for Summer EBT usually takes 10 minutes or less.","To receive food benefits for Summer 2026, you must apply by [Date]. Applying for Summer EBT usually takes 10 minutes or less.","Para recibir beneficios de alimentos en el verano de 2026, debe aplicar antes de [Fecha]. Presentar una solicitud para Summer EBT suele tomar 10 minutos o menos.","Para recibir beneficios de alimentos en el verano de 2026, debes aplicar antes de [Fecha]. La acplicación para Summer EBT suele tomar 10 minutos o menos.",
S1 - Result - Apply for SEBT - Body 4,"After you apply, you will be contacted by mail once your application is reviewed.","After you apply, you will be contacted once your application is reviewed.","Después de que entregues tu aplicación, te contactarán cuando la hayan revisado.","Después de que envíes tu solicitud, te vamos a contactar cuando la revisemos.",
S1 - Result - Apply for SEBT - Accordion Title,How do I know if they're eligible?,How do I know if they're eligible?,¿Cómo sé si pueden calificar?,¿Cómo sé si pueden calificar?,
S1 - Result - Apply for SEBT - Accordion Body 1,You should apply if your child attends a school that participates in the National School Lunch Program (NSLP) or School Breakfast Program (SBP).,You should apply if your child attends a school that participates in the National School Lunch Program (NSLP) or School Breakfast Program (SBP).,"Si tu hijo va a una escuela que participa en el Programa Nacional de Almuerzos Escolares (NSLP) o el Progama de Desayunos Escolares (SBP), deberías aplicar.","Si tu hijo va a una escuela que participa en el Programa Nacional de Almuerzos Escolares (NSLP) o el Progama de Desayunos Escolares (SBP), deberías aplicar.",
S1 - Result - Apply for SEBT - Accordion Body 2,Tap here to continue your application,Tap here to fill out an application,Toca tu pantalla aquí para continuar con tu aplicación,Toca tu pantalla aquí para llenar una solicitud,
S1 - Result - Apply for SEBT - Accordion Body 3,You may also use the dropdown below to check how much money your household can make in a year to be eligible.,You may also use the dropdown below to check how much money your household can make in a year to be eligible.,Puedes usar este menú para ver cuánto dinero puede ganar tu familia en un año para calificar,Puedes usar este menú para ver cuánto dinero puede ganar tu familia en un año para calificar.,
S1 - Result - Apply for SEBT - Accordion Label Select Number People,Select the number of people in your household,Select the number of people in your household,Selecciona el número de personas que viven en tu hogar,Selecciona el número de personas que viven en tu hogar,
S1 - Result - Apply for SEBT - Accordion Body Alert Income,"If your household's total gross income is less than [$28,953] every year, you are likely to be eligible. Gross income is the amount before any deductions, taxes, or expenses are taken out.","If your household's total gross income is less than [$28,953] every year, you are likely to be eligible. Gross income is the amount before any deductions, taxes, or expenses are taken out.","Si el ingreso total de tu hogar es menos de $28,953 cada año, es probable que califiques El ingreso total es la cantidad antes de que se hagan deducciones, impuestos o gastos.","Si el ingreso total de tu hogar es menos de $28,953 cada año, es probable que califiques El ingreso total es la cantidad antes de que se hagan deducciones, impuestos o gastos.",
S1 - Result - Apply for SEBT - Card 1 Title,"To receive benefits for this summer, you must apply by August 25","To receive benefits for this summer, you must apply by August 25",Para recibir beneficios para este verano debe presentar su solicitud antes del 25 de agosto,Para recibir beneficios para este verano debes presentar tu solicitud antes del 25 de agosto,
S1 - Result - Apply for SEBT - Card 1 Body,"The sooner you apply, the sooner your application will be reviewed. Applying for Summer EBT usually takes 15 minutes or less.","The sooner you apply, the sooner your application will be reviewed. Applying for Summer EBT usually takes 10 minutes or less.","Cuanto antes presente su solicitud, más rápido se revisará. Solicitar beneficios de Summer EBT suele tardar 15 minutos o menos.","Mientras más pronto envíes tu solicitud, más pronto la vamos a revisar. Solicitar Summer EBT normalmente toma 15 minutos o menos.",
S1 - Result - Apply for SEBT - Card 1 Action,Apply for Summer EBT,Apply for Summer EBT,Solicitar Summer EBT,Aplicar para Summer EBT,
S1 - Result - Apply for SEBT - Notify Title,,Online applications open June 8 — sign up to be notified when you can apply:,,,
S1 - Result - Apply for SEBT - Notify Label Email,,Enter your email address,,,
S1 - Result - Apply for SEBT - Library Applications,Copies of the paper application are also available at DC public libraries.,Copies of the paper application are also available year-round at DC public libraries.,También hay copias de la solicitud disponibles en las bibliotecas públicas de DC.,También hay copias de la aplicación disponibles en las bibliotecas públicas de DC.,
S1 - Result - Apply for SEBT - Notify Success ,,Your email address has been submitted. We’ll notify you when the online application is available.,,,
S1 - Result - Apply for SEBT - Card 2 Title,Do you have other children in your household?,Do you have other children in your household?,¿Tiene otros hijos en su grupo familiar?,¿Tiene otros hijos en tu hogar?,
S1 - Result - Apply for SEBT - Card 2 Body,"To check if you need to submit a Summer EBT application for any other school-age children in your household, please provide their information by clicking on the button below.","To check if you need to submit a Summer EBT application for any other school-age children in your household, please provide their information by clicking on the button below.","Para verificar si necesita presentar una solicitud de Summer EBT para algún otro menor en edad escolar de su grupo familiar, proporcione su información haciendo clic en el botón a continuación.","Para verificar si necesitas entregar una aplicación para Summer EBT para algún otro menor en tu hogar que está en edad escolar, proporciona tu información haciendo clic en el botón a continuación.",
S1 - Result - Apply for SEBT - Card 2 Action,Check another child,Check another child,Revisar otro(a) niño(a),Revisar otro(a) niño(a),
S1 - Result - Streamlined Enrolled - Title,"Looks like your child is eligible, and you DO NOT need to submit an application for this child","Looks like your child is eligible, and you DO NOT need to submit an application for this child",Parece que su hijo(a) es elegible y NO es necesario que presente una solicitud.,Parece que tu hijo(a) califica y NO es necesario que aplique.,
